id,bubble,ai_event_id
5510,내 기록이 깨지다니. 빨리 원인을 분석해야겠군.,1655
5511,어둠의 경주를 이기다니. 보통이 아니었군. 분하지만 패배를 인정한다.,1656
5513,출발 안 하고 뭐하나? 아... 혹시 출발이 두려운 건가?,1657
5514,뭐지? 나에게 말을 걸 정도로 도전에 여유가 있단 말인가? 흥미롭군.,1658
5515,배달에 성공했다 하셨소? 쉽진 않았을 텐데 대단하오.,1652
5516,오늘도 안녕하신가요?,734
5517,이번에 시음하는 음료 반응이 좋으면 초승달 왕좌로 가서 판매할까 해요. 어떻게 생각하세요?,734
5518,솔즈리드 반도 곳곳에 시음대가 있을 거예요. 당분간은 무료니 마음껏 드세요.,734
5519,오늘도 음료를 나눠드리려고 왔어요! 헤헤.,734
5520,이 마을 소식 중에 궁금한 게 있으면 내 옆에 있는 파리시 친구한테 물어보시게.,742
5521,아주 자네의 정신이 쏙 빠질 때까지 말을 쉬지 않고 할 테니 들을 각오가 되어있다면 말이지. 하하.,742
5522,"말은 많지만, 이상한 사람은 아니니 오해는 하지 말게. 착한 친구라고.",742
5523,"아아, 나한테 말 걸지 말아줘. 난 파리시의 지긋지긋한 수다를 듣느라 너무 피곤해서 좀 쉬어야겠어.",743
5524,로나가 아직도 많이 아프다던데 걱정이 되는군...,744
5525,나라면 아름다운 로나를 저렇게 두지 않았을 거야. 아... 내가 그때 용기만 냈었더라도...,744
5526,"@NPC_NAME(390) 님이 뭐라고 하셨어? 궁금한데, 알려주면 안 돼?",383
5527,@NPC_NAME(390) 님께 어서 가봐. 널 기다리시고 계신 거 같으니까.,456
5530,나는 언제 이곳을 졸업할 수 있을까?,174
5531,@PC_NAME(0)! 달리는 골짜기를 내려가면 무시무시한 녀석들을 만나게 될 테니 정신 똑바로 차려.,174
5532,나에게도 명예로운 죽음의 결투가 다가오고 있네... 그 전에 제자들에게 모든 기억을 가르쳐야 할 텐데 걱정이군.,179
5533,조상신의 가호가 함께하길,183
5534,으음? 내게 할 말 있소?,1654
5535,후륜구동 차량은 운전자를 성장시킨다오.,1654
5536,아들 녀석은 내 차량을 가지고 어디로 간 거지?,1654
5537,동 테미 제국 정벌의 영광을 내 손으로 다시 한 번 이루겠다! ,1648
5538,또 다시 전투가 일어나 우리를 기쁘게 할 것이다.,1659
5539,황제의 분부에 따라 적을 모두 물리칠 것이다.,1659
5540,뭘봐?,1660
5541,침입자다!,1661
5542,"쉿, 사냥감이 도망가.",1662
5543,오늘의 사냥감이군,1663
5544,밥 먹을 때가 지난 거 같은데.,1664
5545,산산조각 내주마!,1665
5546,일해 일!,1666
5547,저리 꺼져!,1667
5548,왜 그 돌이 없는걸까..,1668
5549,뜨거운 피로 손을 적셔볼까?,1669
5550,배고파.,1670
5551,맛있겠다. 쩝쩝.,1671
5552,밥 줘.,1672
5553,배고파.,1673
5554,싸움 한 판하고 몸 풀고 싶구만.,1674
5555,"덤벼, 덤비라고. 겁쟁이 녀석!",1675
5556,살점이 떨어져 나갔어.,1676
5557,심장을 도려내주마.,1677
5558,살찐 내 해골말 본 적 있어?,1678
5559,너도 내 꼴로 만들어주마.,1679
5560,죽어서도 짐을 지고 다녀야 하다니.,1680
5561,눈깔 사탕보다 맛있는 눈알 내놔!,1681
5562,방금 도려낸 눈알 싸게 살래?,1682
5563,"내 보물, 콜록콜록.",1683
5564,내가 여기서 제일 강해!,1684
5565,새 먹잇감으로 딱이군!,1685
5566,오늘은 뭘하고 놀까?,1686
5567,오드득,1687
5568,오늘은 뭘하고 놀까?,1688
5569,오드득,1689
5570,오늘은 뭘하고 놀까?,1690
5571,오드득,1691
5572,하찮은 인간 따위가 물 속에 들어오다니!,1692
5573,단잠 잘 자고 있었는데 누가 깨웠어!,1693
5574,오늘은 뭘하고 놀까?,1694
5575,Fresh~ meat!,1695
5576,오늘은 뭘하고 놀까?,1696
5577,오드득,1697
5578,아이고~허리야.,1698
5579,이런~네 놈은 뭐하는 놈이냐!,1699
5580,음~ 산책하기 좋은 날씨군요.,1700
5581,인간 사냥하기 좋은 날씨군요,1701
5582,다댜더뎌도됴두듀드디,1702
5583,다댜더뎌도됴두듀드디,1703
5584,다댜더뎌도됴두듀드디,1704
5585,다댜더뎌도됴두듀드디,1705
5586,다댜더뎌도됴두듀드디,1706
5587,다댜더뎌도됴두듀드디,1707
5588,다댜더뎌도됴두듀드디,1708
5589,다댜더뎌도됴두듀드디,1709
5590,다댜더뎌도됴두듀드디,1710
5591,다댜더뎌도됴두듀드디,1711
5592,하찮은 인간 따위가 물 속에 들어오다니!,1712
5593,인간 주제에 물 속에 들어오다니!,1713
5594,모두들...경비를...철저하게...하라...,1714
5595,너도...초승달 왕좌에서...보내온...녀석이겠지?...,1715
5596,어디를 털지? 뭐 아는 데 없나?,1716
5597,몸이 근질근질했는데 잘 됐구나!,1717
5598,안녕하시오. 날씨가 좋구려.,1718
5599,도와주시오. 고블린들에게 습격당해 마차가 부서졌소!,1719
5600,이봐요. 우리 마을 좀 도와주시오.,1720
5602,내 사랑을 방해하지 마시오!,1722
5603,룰룰루...,1723
5604,큭큭,1724
5605,휘익~ 침입자다.,1725
5607,겁을 상실한 녀석이군.,1727
5613,각오는 하고 왔겠지?,1733
5615,"어이, 가진 것 다 내놔!",1735
5617,"어이, 가진 것 다 내놔!",1737
5618,룰룰루...,1738
5619,"얼씨구나, 잘 걸렸다.",1739
5620,릴리엇강 상류 나무는 정말 훌륭하죠. 베어서 곧 다리로 삼아도 이상 없어요.,1740
5621,가랑돌 평원 전체에 목재를 원활하게 공급하는 게 내 임무죠. 하지만 언덕 위에 몬스터가 많아서 해야할 일을...,1741
5623,가만 두지 않겠다!,1743
5624,푸후! 되는 일이 하나도 없어!,1744
5625,침입자다!,1745
5626,"이이인~생이야~, 한 잔 술~우우~이던가~.",1746
5627,형님의 아키움 조각을 지켜라!,1747
5629,"여기, 두들링이 있어요. 누가 좀 잡아주세요.",1749
5630,"이 실험만 성공하면! 아들아, 영원한 생명은 네 것이야!",1750
5631,우리는 악마 여왕님을 위해 이니스테르를 차지할 것이다!,1751
5632,악덕 지주 올리비아는 두들링 따위는 내 알바 아니라면서 그저 포도나 따오라고 독촉하는군!,1752
5633,포도밭을 두들링들이 홀라당 뒤집어놨어!,1753
5634,끙차끙차,1754
5635,에헤레디야~,1755
5636,난 그저 좀 쉬고 싶을 뿐이고...,1756
5637,일단 쏘고 보자!,1757
5638,일단 쏘고 보자!,1758
5639,"밖에 오크가 보이는군요, 조심하세요",1759
5640,막아랏!,1760
5641,이 곳을 지키는 중입니다,1761
5642,"대사제님, 안에서 시실루스님께서 애타게 기다리고 계십니다.",1762
5646,여기가 감히 어디라고!,1766
5647,침입자가 나타났다!,1767
5648,으으...!,1768
5649,사냥감이 걸려들었군!,1769
5651,"두 대륙의 녹색이여, 영원하라!",1771
5652,...응?,1772
5653,뭐하는 놈이냐?!,1773
5655,"뭐야, 넌!",1775
5656,(벌떡),1776
5657,우리를 버렸어...,1777
5658,버릴 때는 언제고!,1778
5659,토사구팽이라더니...,1779
5660,-_-+,1780
5661,소리 질러!,1781
5662,이봐! 형씨! 뭘 봐!,1782
5663,물건 좀 보고 가세요.,1783
5664,날파리가 숨어들어왔군,1784
5665,야타 똥을 기계제작소에 던지자!,1785
5667,야타 똥을 받아라!,1787
5668,여기서 당장 사라져!,1788
5669,동네 사람들! 거미가 마을에 침략했어요!,1789
5670,사슴아! 어여 깨어나서 이리로 와라! 아이고! 저러다 죽겠네!,1790
5671,작동 이상! 작동 이상!,1791
5672,새로운 먹잇감이군.,1792
5673,낄낄낄...,1793
5674,우리에게 칼을 들이대다니 어리석은 놈이군,1794
5675,"이곳은 여신의 안식처, 여신과 스스로에게 부끄러울 행동은 자제하시기 바랍니다.",1795
5676,"이곳은 여신의 안식처, 되도록 조용히 다녀주십시오.",1796
5677,안식하라! 모든 인간은 파괴신을 위한 제물!,1797
5678,네 녀석도 데려가주마!,1798
5679,룰룰루...,1799
5680,경배해라! 천것들아!그래도 난 관대하다.,1800
5681,룰룰루...,1801
5682,대왕님 만세! 난 안 관대함,1802
5684,[삐융~ 삐이이융~],1804
5686,욱욱우~,1806
5687,누구냐! 우리 얼굴을 본 이상 살려둘 수 없다!,1807
5688,침입자다!,1808
5689,마을에서 당장 나가!,1809
5690,"누구냐, 넌! 당장 썩 꺼져!",1810
5692,어디선가 더러운 오크 냄새가...,1812
5693,조준 중,1813
5694,우방을 위해서라면,1814
5695,"들린다, 그들의 발걸음이",1815
5696,디스 이즈 초승파르타!,1816
5697,오랏!,1817
5698,[음.],1818
5699,준비 됐습니다.,1819
5700,뿌우-,1820
5701,"베스, 내가 네 곁에 있었어야 했는데...",1821
5702,오랫만이구만. 술이라도 한 잔 하겠나?,1822
5703,"안 됐지만, 자넨 이제 지상에서 사라져 줘야겠네!",1823
5704,"친구, 그 녀석은 대체 어떻게 되었나?",1824
5705,눈엣가시 같은 녀석! 죽어라!,1825
5706,우우~,1826
5707,네놈이 나의 수하들을 쓰러트렸느냐? 내 친히 너를 죽이리라!,1827
5710,날 이딴 힘없는 물에서 끄집어 내라!,1830
5711,밤낮을 가리지 않고 먹고 먹고 또 먹어도 채워지지 않아.,1831
5712,보고만 있을텐가? 빛나는 돌 채취 좀 도와줘,1832
5713,잡아랏,1833
5714,"보고만 있을텐가? 이 곳 골렘, 거인들 안에는 빛나는 무언가가 있어",1834
5715,얍!,1835
5716,선빵이 최고지,1836
5717,받아랏,1837
5718,이쯤에서 돌아가라! 따라오지 말고!,1838
5719,드륵 드륵,1839
5720,왔구나. 거미의 먹이감. 대신관과의 협약. 아무도 들어가지 못한다!,1840
5721,오만하게 여기 들어온 자의 최후를 가르쳐주마!,1841
5722,하일트님 방으로 가는 엘리베이터 열쇠를 찾고 있나? 쉽게 넘겨 주진 않겠다!,1842
5723,"놈이 스위치에 접근하려고 한다, 막아라!",1843
5724,어리석은... 네놈들은 영원히 이해하지 못할거다!,1844
5725,살려주세요.,1845
5726,꺄아아아.,1846
5727,시치미 왕 자바바 만세!,1847
5728,난 이제 이렇게 좋은 걸 공유해준 시치미 약탈단에 들어갈 거야.,1848
5730,시치미 약탈단의 유혹을 이겨낼 거야.,1850
5731,뭐하는 놈이냐! 썩 꺼져라!,1851
5732,끼륵...,1852
5733,꾸웨웩!!,1853
5734,어떤 녀석이 나를 불렀느냐! 네 녀석이냐?,1854
5735,이 주변에 수상한 첩자녀석을 봤는가? 내 눈에 띄기만 하면... 확!,1855
5736,"오냐, 맘껏 덤벼라! 공사장은 내가 지킨다.",1856
5737,바다 여신께서 제물을 원하신다!!,1857
5738,네 이놈! 여긴 어떻게 들어왔느냐!,1858
5739,우리는 도망자를 찾고 있습니다!,1859
5740,연구하란답시고 보내놓고 다들 나를 버렸어!,1860
5741,멍멍,1861
5743,쥐새끼 한마리가 숨어들었군!,1863
5744,거기 누구냐?!,1864
5745,뭐지?,1865
5746,이 안델프의 개들!,1866
5747,하일트님의 위대한 연구를 방해할 참이냐!,1867
5748,"악취나는 폐기물 같은 놈들, 전부 죽어라!",1868
5749,가뜩이나 피부 트러블 때문에 신경질나 죽겠는데!,1869
5750,화학공장 입구에서 정체불명의 침입자 발견! 즉시 제거하겠습니다!,1870
5751,인증되지 않은 사용자가 골렘 실험실 입구에서 포착되었습니다. 즉시 제거합니다.,1871
5752,반갑습니다. 이곳은 마하데비로부터 호랑이 등뼈 산맥을 거쳐 매사냥 고원까지 가는 비행선을 탈 수 있는 곳입니다.,1872
5753,침입자다!,1873
5754,다른 층에 있는 형제들에게 알려! 이놈들이 올라가지 못하게 해야해!,1874
5755,이 골렘으로 저놈들을 뭉개버려!,1875
5756,하일트님이 위험해!,1876
5757,이놈들을 위로 올려보내선 안돼!,1877
5758,훼방꾼이다!,1878
5759,모두 준비한 햇불을 던져!,1879
5760,유후!,1880
5763,"보랏빛 열매, 마시기 좋은 물을 이 항아리와 함께 사용하면 증류기에서 증류할 준비가 되겠지. 지금 함께 있는 다양한 종족들의 미래도 이처럼 잘 어우러지면 좋으련만...",1883
5765,"버러지들, 내게 충성을 맹세해라!",1885
5766,[......!!],1886
5767,[적봤을때대사],1887
5768,[인터렉션대사],1888
5769,켁!켁! 나한테 뭘 먹인거야?!,1889
5770,어머~ 새로운 먹잇감이네~,1890
5771,안녕~,1891
5772,죽지 못한 전우여.,1892
5773,너놈이 나를 불렀느냐?,1893
5774,[아버지는 말하셨지~ 인생을 즐겨라~~ 그러다가 망하셨지 인생을 즐기다~~],1894
5775,이제 이 녀석으로 변장해서 영원한 잠의 재료를 가로채도록 하자!,1895
5776,싱싱한 재료가 제발로 찾아왔구나!,1896
5777,우오오오~우오옹!!,1897
5778,으악. 살려줘!,1898
5779,위험!침입자다,1899
5782,다 털어 버려!,1902
5783,이 빌어먹을 녀석들이 언제 탈출했지?,1903
5787,떠돌이가 점점 많아지는군. 경계를 강화해야겠어.,1907
5788,이곳을 저런 멋진 분이 지켜주면 좋을 텐데.,1379
5789,이곳을 저런 멋진 분이 지켜주면 좋을 텐데.,1409
5790,떠돌이가 점점 많아지는군. 경계를 강화해야겠어.,1908
5791,이곳을 저런 멋진 분이 지켜주면 좋을 텐데.,1416
5792,떠돌이가 점점 많아지는군. 경계를 강화해야겠어.,1909
5793,떠돌이가 점점 많아지는군. 경계를 강화해야겠어.,1910
5794,이곳을 저런 멋진 분이 지켜주면 좋을 텐데.,1423
5795,발소리 같은 게 들린 것 같은데...잘못 들었나.,1911
5796,떠돌이가 점점 많아지는군. 경계를 강화해야겠어.,1912
5797,이곳을 저런 멋진 분이 지켜주면 좋을 텐데.,1434
5799,이곳을 저런 멋진 분이 지켜주면 좋을 텐데.,1449
5800,발소리 같은 게 들린 것 같은데...잘못 들었나.,1913
5801,떠돌이가 점점 많아지는군. 경계를 강화해야겠어. ,1914
5802,이곳을 저런 멋진 분이 지켜주면 좋을 텐데.,1445
5804,이곳을 저런 멋진 분이 지켜주면 좋을 텐데.,1448
5805,발소리 같은 게 들린 것 같은데...잘못 들었나.,1915
5806,떠돌이가 점점 많아지는군. 경계를 강화해야겠어.,1916
5808,이곳을 저런 멋진 분이 지켜주면 좋을 텐데.,1461
5809,이곳을 저런 멋진 분이 지켜주면 좋을 텐데.,1458
5810,발소리 같은 게 들린 것 같은데...잘못 들었나.,1917
5811,떠돌이가 점점 많아지는군. 경계를 강화해야겠어.,1918
5813,이곳을 저런 멋진 분이 지켜주면 좋을 텐데.,1474
5815,이곳을 저런 멋진 분이 지켜주면 좋을 텐데.,1471
5816,발소리 같은 게 들린 것 같은데...잘못 들었나.,1919
5818,이곳을 저런 멋진 분이 지켜주면 좋을 텐데.,1488
5819,이곳을 저런 멋진 분이 지켜주면 좋을 텐데.,1494
5820,떠돌이가 점점 많아지는군. 경계를 강화해야겠어.,1920
5821,떠돌이가 점점 많아지는군. 경계를 강화해야겠어.,1921
5822,이곳을 저런 멋진 분이 지켜주면 좋을 텐데.,1508
5823,떠돌이가 점점 많아지는군. 경계를 강화해야겠어.,1922
5824,이곳을 저런 멋진 분이 지켜주면 좋을 텐데.,1523
5825,용건이라도?,1525
5826,떠돌이가 점점 많아지는군. 경계를 강화해야겠어.,1923
5827,이곳을 저런 멋진 분이 지켜주면 좋을 텐데.,1537
5828,떠돌이가 점점 많아지는군. 경계를 강화해야겠어.,1924
5829,이곳을 저런 멋진 분이 지켜주면 좋을 텐데.,1547
5830,발소리 같은 게 들린 것 같은데...잘못 들었나.,1925
5831,떠돌이가 점점 많아지는군. 경계를 강화해야겠어.,1926
5832,이곳을 저런 멋진 분이 지켜주면 좋을 텐데.,1558
5833,이곳을 저런 멋진 분이 지켜주면 좋을 텐데.,1561
5834,발소리 같은 게 들린 것 같은데...잘못 들었나.,1927
5835,떠돌이가 점점 많아지는군. 경계를 강화해야겠어.,1928
5837,이곳을 저런 멋진 분이 지켜주면 좋을 텐데.,1580
5838,이곳을 저런 멋진 분이 지켜주면 좋을 텐데.,1576
5839,발소리 같은 게 들린 것 같은데...잘못 들었나.,1929
5840,떠돌이가 점점 많아지는군. 경계를 강화해야겠어.,1930
5841,이곳을 저런 멋진 분이 지켜주면 좋을 텐데.,1505
5842,이곳을 저런 멋진 분이 지켜주면 좋을 텐데.,1509
5843,발소리 같은 게 들린 것 같은데...잘못 들었나.,1931
5844,떠돌이가 점점 많아지는군. 경계를 강화해야겠어.,1932
5845,이곳을 저런 멋진 분이 지켜주면 좋을 텐데.,1526
5846,이곳을 저런 멋진 분이 지켜주면 좋을 텐데.,1531
5847,발소리 같은 게 들린 것 같은데...잘못 들었나.,1933
5848,떠돌이가 점점 많아지는군. 경계를 강화해야겠어.,1934
5851,이곳을 저런 멋진 분이 지켜주면 좋을 텐데.,1581
5852,발소리 같은 게 들린 것 같은데...잘못 들었나.,1935
5853,떠돌이가 점점 많아지는군. 경계를 강화해야겠어.,1936
5854,이곳을 저런 멋진 분이 지켜주면 좋을 텐데.,1590
5855,이곳을 저런 멋진 분이 지켜주면 좋을 텐데.,1593
5856,발소리 같은 게 들린 것 같은데...잘못 들었나.,1937
5857,떠돌이가 점점 많아지는군. 경계를 강화해야겠어.,1938
5858,이곳을 저런 멋진 분이 지켜주면 좋을 텐데.,1602
5859,이곳을 저런 멋진 분이 지켜주면 좋을 텐데.,1605
5860,다후타 교단의 세력이 커지고 있어서 걱정이에요.,592
5861,잊힌 대륙에서 일어났던 일이 이곳에서 다시 일어나면 안 될 텐데...,592
5862,발소리 같은 게 들린 것 같은데...잘못 들었나.,1939
5863,떠돌이가 점점 많아지는군. 경계를 강화해야겠어.,1940
5864,이곳을 저런 멋진 분이 지켜주면 좋을 텐데.,1617
5865,이곳을 저런 멋진 분이 지켜주면 좋을 텐데.,1614
5866,발소리 같은 게 들린 것 같은데...잘못 들었나.,1941
5867,떠돌이가 점점 많아지는군. 경계를 강화해야겠어.,1942
5868,이곳을 저런 멋진 분이 지켜주면 좋을 텐데.,1626
5870,이곳을 저런 멋진 분이 지켜주면 좋을 텐데.,1629
5871,어떻게 이런 일이...,721
5872,참 세상이 어찌 되려고 이러나 모르겠네.,200
5873,아프다... 아퍼...,212
5874,...,213
5875,내 수련장은 다음 대 기억술사가 될 자들이 잘 돌보고 있다네. 절대 팽개치고 여기서 놀고 있는 게 아니야.,304
5876,인도자의 열매 맛을 한 번 보면 잊을 수 없어.,583
5877,네가 바로 하르파 수련장에서 온 사람이구나.,583
5878,촉촉한 흙더미를 찾고 싶다면 붉은 조약돌 달팽이가 있는 곳을 찾으면 될 거야. 그놈들은 촉촉한 곳을 아주 좋아하거든.,583
5879,이곳에 정차하는 마차는 여기서부터 릴리엇 구릉지의 바람그늘 마을까지 순환하는 마차다라라.,957
5880,이 망원경은 비행선이나 마차가 어디에 와 있는지 당장 알려준다라라. 정말 편리하다라라.,957
5881,날 너무 기다리게 하지 않았으면 좋겠어.,396
5882,내가 항상 웃고 있을 거라 생각하지 마.,396
5883,질투는 나의 힘이야.,396
5884,이보게. 숲의 나무들을 소중히 다뤄주게나.,342
5885,지난번 솔즈리드에서 놀러 왔던 린엘과 리포포는 잘 지내고 있을까? 혹시 그들을 만나게 되면 내 안부 인사를 전해주겠나?,342
5886,내 친구 녀석은 먼 타향에서 그렇게 고생을 하고 있다더군.,342
5887,"역시 그 벨리온이란 자, 만만치 않은 놈이야.",343
5888,당신이 바로 하르파 수련장에서 온 사람이군요.,584
5889,엔비어스가 유력하다더니... 그는 탈락했나 보군요.,584
5890,수습생의 길이란 힘들어. 나도 언젠가는 스승님 같은 장인이 될 테야.,587
5891,다후타 교단은 바다를 관장한다고 하지요.,600
5892,익사체가 생겨난 것이 다후타 여신과 관계있지 않을까 하는 의심이 드는군요.,600
5893,역시 엘프가 시키는 일을 맡는 게 아니었는데... ,349
5894,대홍수가 일어나기 전에 배 건조를 마쳐야 할 텐데...,591
5895,"다후타 여신의 목소리를 듣지 못했다면, 난 죽은 목숨이겠지.",591
5896,아이 씨족 출신인 날 우습게 보지 말라고!,585
5897,"내 이름을 어디에서 들어본 것 같다고? 그야, 당연하지. 난 유명하거든.",585
5898,치워도 치워도 가시덩굴이 계속 자라고 있어요.,601
5899,가시덩굴의 생명력은 정말 끔찍할 정도네요.,601
5900,저기 구석에서 떨고 있는 오그마란 자에게 말을 걸어보세요. 아까부터 횡설수설하는 게 상태가 이상해요.,601
5901,발소리 같은 게 들린 것 같은데... 잘못 들었나.,1411
5902,발소리 같은 게 들린 것 같은데... 잘못 들었나.,1527
5903,제가 가장 멀리 가본 곳은 로카의 장기말들이라는 곳인데 혹시 가보셨나요? 그곳을 지도에 담는 것은 굉장히 힘든 일이었지요. 매우 많은 봉우리에 올라가야 했거든요.,700
5904,나중에 모든 지도를 완성하면 저를 기다리고 있는 우리 가족들과 그곳에서 살고 싶어요.,700
5905,제이크를 알고 있나요? 저에게 지도를 의뢰한 분이지요. 그런데 생각보다 쉬운 일이 아니라 고생이 이만저만이 아니네요.,700
5906,지도를 그리기 위해 집을 떠난 게 언제인지 모르겠어요. 어느 날 가보니 아이가 많이 자랐더군요. 이야기를 하다 보니 우리 아이가 보고 싶네요.,700
5907,나중에 우리 남편을 보면 전해주세요. 곧 돌아간다고요. 아! 우리 남편은 황금 평원의 작은 우리집에서 살고 있어요. ,700
5908,궁금한 곳이 있으면 지도를 열어보세요. 당신이 보는 그 지도가 제가 만든 거랍니다. 후훗.,700
5909,이곳을 저런 멋진 분이 지켜주면 좋을 텐데.,1565
5910,웬 놈이냐!,1763
5911,애송이 한 놈이 드디어 걸렸군!,1764
5912,소문으로만 듣던 |nn;@SPECIFY_TARGET_NAME(0)|r 님을 이렇게 뵙다니 영광입니다!,1155
5928,미래의 약속은 현재와 결합해야 더 강력해지는 법이로로.,1944
5968,|cff00ff45루루의 딱지|r를 가지고 있나루루?,1945
5969,이 자판기가 |cff00ff45루루의 딱지|r를 유용한 물건으로 바꿔준다루루~,1945
5970,델피나드에 관심있나루루?,1943
5971,델피나드의 유산에는 값진 물건이 봉인되어 있지루루~,1943
5972,어떤 물건이 나올지 궁금하지 않나루루?,1943
5973,델피나드에 관심있나루루?,1943
5974,델피나드에 관심있나루루?,1943
5975,델피나드에 관심있나루루?,1943
5976,침입자다!,1765
5977,한번 골라보세요.,351
5978,갈증을 해소할 마법의 음료 판매합니다.,1862
5979,이곳에 정차하는 마차는 여기서부터 호랑이 등뼈 산맥까지 순환하는 마차다라라.,983
5980,이 망원경은 비행선이나 마차가 얼마나 다가왔는지 당장 알려줘서 정말 편리하다라라.,983
5981,채석기계가 고장 나서 이게 무슨 고생이냔 말이오!,551
5982,야생말 우유는... 아직인가요?,554
5983,이번 달 생활비는... 아버지 약값은...,561
5984,"에효, 어머니가 그 값비싼 목걸이만 사지 않으셨어도...",561
5985,당신에게 볼일은 없는 것 같군.,559
5986,우리 나라야나들은 하리하란 상단을 돕고 있지. 짐이라면 걱정하지 말고 맡겨봐.,563
5987,이래 봬도 아직 스무 해밖에 살지 않았어.,563
5988,더러운 놀들을 아직도 몰아내지 못한 거야?,562
5989,상단의 장물은 아직도 인가?,568
5990,요즘 들어 일거리가 많아졌습니다.,722
5991,이 많은 집 중에서 정작 제집은 하나도 없지 뭡니까.,722
5992,먹고 살려니 이 늦은 시간에도 망치를 놓을 수가 없습니다.,723
5993,야간에는 보수가 좀 더 좋습니다. 하지만 사람은 역시 밤에는 자야 하는 거 아니겠습니까.,723
5994,계속 야간에 일을 하니 좀처럼 피로가 풀리질 않네요.,723
5995,그림자 매에게 물건을 바치고 표식을 남기면 찾아오지요. 그리고 죽음을 맛보게 한답니다...,517
5996,이런 곳에 산 자가 오다니... 그림자 매가 두렵지도 않은가요...,517
5997,낡아 보여도 제법 값이 나가는 것들이랍니다.,731
5998,도와주세요.,1900
5999,도와줘요.,1901
6000,"그 먼 옛날 옛날, 대마라 피눈물의 치찰라이는 말했지. 대초원의 원수가 이동하는 제국의 원수. 신의 채찍이 적을 벌하리라.",820
6001,피묻은 갈기를 세우고 눈사자를 세차게 몰고 달리는 분. 붉은 함성을 외치며 눈사자를 세차게 몰고 달리는 분. 어두운 길에 빛을 뿜으며 눈사자를 세차게 몰고 달리는 분.,820
6002,"테레나 총독의 잘린 머리가 까마귀로 변해 도망치려 할 때, 영웅은 <최우의 유령>을 꺼내었지. 아무것도 없는 빈 활에서 번개처럼 빛나는 화살이 날아갔네. 모두가 그 활을 두려워했지.",820
6003,"파괴신과 바람의 신이 함께 다니던 시절, 델피나드는 찬란히 빛났고 우리의 전사들은 대초원을 달렸다네. 하지만 지금 우리의 땅은 척박한 고원. 대초원을 다시 내달릴 자 누구란 말인가.",820
6004,"피눈물의 치찰라이의 말을 새겨라. 바람의 신에 대해 잊는 순간, 다시 정착하는 자의 발에 짓밟힐지니. 오직 땅을 달려라. 칠흑 같은 어둠에는 별의 빛을 따라, 낮에는 바람의 길을 따라.",820
